{
  "protocol": "reported-v1",
  "before": {
    "protocol": "reported-v1",
    "plan": "ExamplePlan",
    "node": "example-node",
    "by": "repository-tooling",
    "claim_instance": "claim-example",
    "workspace_identity": "workspace:example",
    "selected": [
      {
        "package": "example.test/project",
        "id": "TestBehavior",
        "file": "internal/example/behavior_test.go"
      }
    ],
    "declared_hazards": {
      "example.test/project::TestBehavior": [
        "external-format"
      ]
    },
    "candidate": {
      "obligation": "sha256:0000000000000000000000000000000000000000000000000000000000000000",
      "artifacts": {
        "internal/example/behavior.go": "sha256:1111111111111111111111111111111111111111111111111111111111111111"
      },
      "dependencies": {},
      "inputs": {},
      "intent": {},
      "selected_test_sources": {
        "example.test/project::TestBehavior": "sha256:2222222222222222222222222222222222222222222222222222222222222222"
      }
    }
  },
  "after": {
    "protocol": "reported-v1",
    "plan": "ExamplePlan",
    "node": "example-node",
    "by": "repository-tooling",
    "claim_instance": "claim-example",
    "workspace_identity": "workspace:example",
    "selected": [
      {
        "package": "example.test/project",
        "id": "TestBehavior",
        "file": "internal/example/behavior_test.go"
      }
    ],
    "declared_hazards": {
      "example.test/project::TestBehavior": [
        "external-format"
      ]
    },
    "candidate": {
      "obligation": "sha256:0000000000000000000000000000000000000000000000000000000000000000",
      "artifacts": {
        "internal/example/behavior.go": "sha256:1111111111111111111111111111111111111111111111111111111111111111"
      },
      "dependencies": {},
      "inputs": {},
      "intent": {},
      "selected_test_sources": {
        "example.test/project::TestBehavior": "sha256:2222222222222222222222222222222222222222222222222222222222222222"
      }
    }
  },
  "phase": "green",
  "started": "2026-01-02T03:04:05Z",
  "completed": "2026-01-02T03:04:06Z",
  "runner": {
    "identity": "repository-unit-tests",
    "environment_identities": {
      "BUILD_CONTEXT": "example-environment"
    }
  },
  "execution": {
    "started": true,
    "completed": true,
    "report_complete": true,
    "exit_code": 0
  },
  "report_digest": "sha256:e3b0c44298fc1c149afbf4c8996fb92427ae41e4649b934ca495991b7852b855"
}
